No,Headline
1,Do China's vanishing officials spell trouble for Xi?
2,Do China's vanishing officials spell trouble for Xi?
3,India suspends visas for Canadians as row escalates
4,Hong Kong investigates popular crypto firm for fraud
5,Murdoch's eldest son Lachlan to head Fox and News Corp
6,Chevron and unions agree to end Australia gas strikes
7,Tourists caught in India-Canada visa row
8,S Korea to protect teachers from bullying parents
9,Australia to host Taylor Swift academic conference
10,"Brand exposed himself then laughed about it on air, says woman"
11,Drugs found in trapdoor at NY fentanyl nursery
12,Toshiba set to end 74-year stock market history
13,Drugs found in trapdoor at NY fentanyl nursery
14,Toshiba set to end 74-year stock market history
15,Five to be charged in UK with spying for Russia
16,India set to approve historic women's quota bill
17,Sophie Turner sues Joe Jonas for children's return
18,Why Western nations fear India-Canada row
19,Who was Canadian Sikh leader Hardeep Singh Nijjar?
20,Anger in India as Trudeau points finger over murder
21,Why are some Sikhs calling for a separate state?
22,How India-Canada ties descended into a public feud
23,South Korea raids US military bases in drugs probe
24,BBC World News TV
25,BBC World Service Radio
26,Violent tornado sends sparks flying in Chinese city
27,Indonesia TikToker jailed over pork video
28,China imports of Japan fish dive over Fukushima release
29,Rupert Murdoch's media empire through the years
30,Trump hands out pizza at Iowa pub
31,The Indian men who photographed dead bodies
32,Riots and amateur sleuths: TikTok's real-life frenzies
33,A haunted Australia stares down bushfire disaster again
34,"Torture, rape, killings: An Indian state's brutal conflict"
35,Murdoch's succession drama reaches its finale
36,What has happened between Poland and Ukraine?
37,Listen: Funding Ukraine…or America First?
38,How atom bomb sensors found blue whales
39,Tech's shocking remote work U-turn
40,Hidden Rome beyond the Colosseum
41,The crime novels dividing opinion
42,The children leaving the Mafia
43,The rise of 'paid paid' time off
44,The 'Champagne' of apple cider
